{
  "audio": {
    "channels": 2,
    "chirp": {
      "high_hz": 2500.0,
      "level_dbfs": -12.0,
      "low_hz": 700.0,
      "ms": 30
    },
    "codec": "pcm_s24le",
    "sample_rate_hz": 48000
  },
  "container": {
    "audio_start_pts": 0,
    "audio_time_base": "1/48000",
    "checks": {
      "audio_first_pts": 0,
      "audio_priming_samples": 0,
      "audio_start_ms": 0.0,
      "audio_start_time": 0,
      "audio_time_base": "1/48000",
      "max_video_pts_error_ms": 0.0,
      "notes": [],
      "ok": true,
      "video_start_time": 0,
      "video_time_base": "1/50"
    },
    "format": "mov",
    "video_start_pts": 0,
    "video_time_base": "1/50"
  },
  "duration_ms": 6000.0,
  "events": [
    {
      "audio_sample": 48000,
      "audio_timeline_ms": 1000.0,
      "chirp_id": 1,
      "event_id": "EVT-000001",
      "expected_av_offset_ms": 0.0,
      "marker_phase": 1,
      "rounding_residual_us": 0.0,
      "seq": 1,
      "video_frame": 50,
      "video_timeline_ms": 1000.0
    },
    {
      "audio_sample": 72000,
      "audio_timeline_ms": 1500.0,
      "chirp_id": 2,
      "event_id": "EVT-000002",
      "expected_av_offset_ms": 0.0,
      "marker_phase": 0,
      "rounding_residual_us": 0.0,
      "seq": 2,
      "video_frame": 75,
      "video_timeline_ms": 1500.0
    },
    {
      "audio_sample": 96000,
      "audio_timeline_ms": 2000.0,
      "chirp_id": 3,
      "event_id": "EVT-000003",
      "expected_av_offset_ms": 0.0,
      "marker_phase": 1,
      "rounding_residual_us": 0.0,
      "seq": 3,
      "video_frame": 100,
      "video_timeline_ms": 2000.0
    },
    {
      "audio_sample": 120000,
      "audio_timeline_ms": 2500.0,
      "chirp_id": 0,
      "event_id": "EVT-000004",
      "expected_av_offset_ms": 0.0,
      "marker_phase": 0,
      "rounding_residual_us": 0.0,
      "seq": 4,
      "video_frame": 125,
      "video_timeline_ms": 2500.0
    },
    {
      "audio_sample": 144000,
      "audio_timeline_ms": 3000.0,
      "chirp_id": 1,
      "event_id": "EVT-000005",
      "expected_av_offset_ms": 0.0,
      "marker_phase": 1,
      "rounding_residual_us": 0.0,
      "seq": 5,
      "video_frame": 150,
      "video_timeline_ms": 3000.0
    },
    {
      "audio_sample": 168000,
      "audio_timeline_ms": 3500.0,
      "chirp_id": 2,
      "event_id": "EVT-000006",
      "expected_av_offset_ms": 0.0,
      "marker_phase": 0,
      "rounding_residual_us": 0.0,
      "seq": 6,
      "video_frame": 175,
      "video_timeline_ms": 3500.0
    },
    {
      "audio_sample": 192000,
      "audio_timeline_ms": 4000.0,
      "chirp_id": 3,
      "event_id": "EVT-000007",
      "expected_av_offset_ms": 0.0,
      "marker_phase": 1,
      "rounding_residual_us": 0.0,
      "seq": 7,
      "video_frame": 200,
      "video_timeline_ms": 4000.0
    },
    {
      "audio_sample": 216000,
      "audio_timeline_ms": 4500.0,
      "chirp_id": 0,
      "event_id": "EVT-000008",
      "expected_av_offset_ms": 0.0,
      "marker_phase": 0,
      "rounding_residual_us": 0.0,
      "seq": 8,
      "video_frame": 225,
      "video_timeline_ms": 4500.0
    },
    {
      "audio_sample": 240000,
      "audio_timeline_ms": 5000.0,
      "chirp_id": 1,
      "event_id": "EVT-000009",
      "expected_av_offset_ms": 0.0,
      "marker_phase": 1,
      "rounding_residual_us": 0.0,
      "seq": 9,
      "video_frame": 250,
      "video_timeline_ms": 5000.0
    },
    {
      "audio_sample": 264000,
      "audio_timeline_ms": 5500.0,
      "chirp_id": 2,
      "event_id": "EVT-000010",
      "expected_av_offset_ms": 0.0,
      "marker_phase": 0,
      "rounding_residual_us": 0.0,
      "seq": 10,
      "video_frame": 275,
      "video_timeline_ms": 5500.0
    }
  ],
  "generator": {
    "core": "1.0.0",
    "version": "1.0.0"
  },
  "mode": "FILE",
  "schema": "mxl-avsync-manifest/1",
  "test_id": "TEST-720p50_prores_pcm24_sync",
  "timeline": "file",
  "video": {
    "codec": "prores_hq",
    "fps_den": 1,
    "fps_num": 50,
    "height": 720,
    "scan": "progressive",
    "width": 1280
  }
}
